{
  "contract": "managed-event-envelope/1",
  "contractVersion": 1,
  "formatVersion": 1,
  "kinds": [
    "input.accepted",
    "wake.requested",
    "activation.changed",
    "model.attempt",
    "message.committed",
    "tool.intent",
    "action.changed",
    "tool.receipt",
    "checkpoint.committed",
    "context.compacted",
    "cancel.requested",
    "turn.settled",
    "config.bound",
    "lifecycle.changed",
    "domain.committed",
    "message.delta",
    "message.retracted",
    "hosted.batch.planned",
    "hosted.cleanup"
  ],
  "streams": ["authoritative_journal"],
  "forbiddenFields": [
    "absolutePath",
    "localPath",
    "pid",
    "pod",
    "runtimeBindingId",
    "runtimeEndpoint",
    "secretHandle",
    "sidecar"
  ],
  "limits": {
    "maxIdBytes": 512,
    "maxTimeMs": 8640000000000000
  },
  "envelope": {
    "v": 1,
    "sessionId": "session-1",
    "tenantId": "tenant-1",
    "workspaceId": "workspace-1",
    "stream": "authoritative_journal",
    "sequence": 42,
    "eventId": "evt-000042",
    "kind": "domain.committed",
    "occurredAt": 1760000000000,
    "payloadRef": {
      "digest": "631f42ee57f8e39d9491a76ba9477d32a11f8c2b8a3a4ff3c21b30760c600000"
    }
  },
  "envelopeCases": [
    {
      "id": "kind-input-accepted",
      "valid": true,
      "envelope": {
        "v": 1,
        "sessionId": "session-1",
        "tenantId": "tenant-1",
        "workspaceId": "workspace-1",
        "stream": "authoritative_journal",
        "sequence": 101,
        "eventId": "evt-000101",
        "kind": "input.accepted",
        "occurredAt": 1760000000001,
        "payloadRef": {
          "digest": "631f42ee57f8e39d9491a76ba9477d32a11f8c2b8a3a4ff3c21b30760c600000"
        }
      }
    },
    {
      "id": "kind-wake-requested",
      "valid": true,
      "envelope": {
        "v": 1,
        "sessionId": "session-1",
        "tenantId": "tenant-1",
        "workspaceId": "workspace-1",
        "stream": "authoritative_journal",
        "sequence": 102,
        "eventId": "evt-000102",
        "kind": "wake.requested",
        "occurredAt": 1760000000002,
        "payloadRef": {
          "digest": "631f42ee57f8e39d9491a76ba9477d32a11f8c2b8a3a4ff3c21b30760c600000"
        }
      }
    },
    {
      "id": "kind-activation-changed",
      "valid": true,
      "envelope": {
        "v": 1,
        "sessionId": "session-1",
        "tenantId": "tenant-1",
        "workspaceId": "workspace-1",
        "stream": "authoritative_journal",
        "sequence": 103,
        "eventId": "evt-000103",
        "kind": "activation.changed",
        "occurredAt": 1760000000003,
        "payloadRef": {
          "digest": "631f42ee57f8e39d9491a76ba9477d32a11f8c2b8a3a4ff3c21b30760c600000"
        }
      }
    },
    {
      "id": "kind-model-attempt",
      "valid": true,
      "envelope": {
        "v": 1,
        "sessionId": "session-1",
        "tenantId": "tenant-1",
        "workspaceId": "workspace-1",
        "stream": "authoritative_journal",
        "sequence": 104,
        "eventId": "evt-000104",
        "kind": "model.attempt",
        "occurredAt": 1760000000004,
        "payloadRef": {
          "digest": "631f42ee57f8e39d9491a76ba9477d32a11f8c2b8a3a4ff3c21b30760c600000"
        }
      }
    },
    {
      "id": "kind-message-committed",
      "valid": true,
      "envelope": {
        "v": 1,
        "sessionId": "session-1",
        "tenantId": "tenant-1",
        "workspaceId": "workspace-1",
        "stream": "authoritative_journal",
        "sequence": 105,
        "eventId": "evt-000105",
        "kind": "message.committed",
        "occurredAt": 1760000000005,
        "payloadRef": {
          "digest": "631f42ee57f8e39d9491a76ba9477d32a11f8c2b8a3a4ff3c21b30760c600000"
        }
      }
    },
    {
      "id": "kind-tool-intent",
      "valid": true,
      "envelope": {
        "v": 1,
        "sessionId": "session-1",
        "tenantId": "tenant-1",
        "workspaceId": "workspace-1",
        "stream": "authoritative_journal",
        "sequence": 106,
        "eventId": "evt-000106",
        "kind": "tool.intent",
        "occurredAt": 1760000000006,
        "payloadRef": {
          "digest": "631f42ee57f8e39d9491a76ba9477d32a11f8c2b8a3a4ff3c21b30760c600000"
        }
      }
    },
    {
      "id": "kind-action-changed",
      "valid": true,
      "envelope": {
        "v": 1,
        "sessionId": "session-1",
        "tenantId": "tenant-1",
        "workspaceId": "workspace-1",
        "stream": "authoritative_journal",
        "sequence": 107,
        "eventId": "evt-000107",
        "kind": "action.changed",
        "occurredAt": 1760000000007,
        "payloadRef": {
          "digest": "631f42ee57f8e39d9491a76ba9477d32a11f8c2b8a3a4ff3c21b30760c600000"
        }
      }
    },
    {
      "id": "kind-tool-receipt",
      "valid": true,
      "envelope": {
        "v": 1,
        "sessionId": "session-1",
        "tenantId": "tenant-1",
        "workspaceId": "workspace-1",
        "stream": "authoritative_journal",
        "sequence": 108,
        "eventId": "evt-000108",
        "kind": "tool.receipt",
        "occurredAt": 1760000000008,
        "payloadRef": {
          "digest": "631f42ee57f8e39d9491a76ba9477d32a11f8c2b8a3a4ff3c21b30760c600000"
        }
      }
    },
    {
      "id": "kind-checkpoint-committed",
      "valid": true,
      "envelope": {
        "v": 1,
        "sessionId": "session-1",
        "tenantId": "tenant-1",
        "workspaceId": "workspace-1",
        "stream": "authoritative_journal",
        "sequence": 109,
        "eventId": "evt-000109",
        "kind": "checkpoint.committed",
        "occurredAt": 1760000000009,
        "payloadRef": {
          "digest": "631f42ee57f8e39d9491a76ba9477d32a11f8c2b8a3a4ff3c21b30760c600000"
        }
      }
    },
    {
      "id": "kind-context-compacted",
      "valid": true,
      "envelope": {
        "v": 1,
        "sessionId": "session-1",
        "tenantId": "tenant-1",
        "workspaceId": "workspace-1",
        "stream": "authoritative_journal",
        "sequence": 110,
        "eventId": "evt-000110",
        "kind": "context.compacted",
        "occurredAt": 1760000000010,
        "payloadRef": {
          "digest": "631f42ee57f8e39d9491a76ba9477d32a11f8c2b8a3a4ff3c21b30760c600000"
        }
      }
    },
    {
      "id": "kind-cancel-requested",
      "valid": true,
      "envelope": {
        "v": 1,
        "sessionId": "session-1",
        "tenantId": "tenant-1",
        "workspaceId": "workspace-1",
        "stream": "authoritative_journal",
        "sequence": 111,
        "eventId": "evt-000111",
        "kind": "cancel.requested",
        "occurredAt": 1760000000011,
        "payloadRef": {
          "digest": "631f42ee57f8e39d9491a76ba9477d32a11f8c2b8a3a4ff3c21b30760c600000"
        }
      }
    },
    {
      "id": "kind-turn-settled",
      "valid": true,
      "envelope": {
        "v": 1,
        "sessionId": "session-1",
        "tenantId": "tenant-1",
        "workspaceId": "workspace-1",
        "stream": "authoritative_journal",
        "sequence": 112,
        "eventId": "evt-000112",
        "kind": "turn.settled",
        "occurredAt": 1760000000012,
        "payloadRef": {
          "digest": "631f42ee57f8e39d9491a76ba9477d32a11f8c2b8a3a4ff3c21b30760c600000"
        }
      }
    },
    {
      "id": "kind-config-bound",
      "valid": true,
      "envelope": {
        "v": 1,
        "sessionId": "session-1",
        "tenantId": "tenant-1",
        "workspaceId": "workspace-1",
        "stream": "authoritative_journal",
        "sequence": 113,
        "eventId": "evt-000113",
        "kind": "config.bound",
        "occurredAt": 1760000000013,
        "payloadRef": {
          "digest": "631f42ee57f8e39d9491a76ba9477d32a11f8c2b8a3a4ff3c21b30760c600000"
        }
      }
    },
    {
      "id": "kind-lifecycle-changed",
      "valid": true,
      "envelope": {
        "v": 1,
        "sessionId": "session-1",
        "tenantId": "tenant-1",
        "workspaceId": "workspace-1",
        "stream": "authoritative_journal",
        "sequence": 114,
        "eventId": "evt-000114",
        "kind": "lifecycle.changed",
        "occurredAt": 1760000000014,
        "payloadRef": {
          "digest": "631f42ee57f8e39d9491a76ba9477d32a11f8c2b8a3a4ff3c21b30760c600000"
        }
      }
    },
    {
      "id": "kind-domain-committed",
      "valid": true,
      "envelope": {
        "v": 1,
        "sessionId": "session-1",
        "tenantId": "tenant-1",
        "workspaceId": "workspace-1",
        "stream": "authoritative_journal",
        "sequence": 115,
        "eventId": "evt-000115",
        "kind": "domain.committed",
        "occurredAt": 1760000000015,
        "payloadRef": {
          "digest": "631f42ee57f8e39d9491a76ba9477d32a11f8c2b8a3a4ff3c21b30760c600000"
        }
      }
    },
    {
      "id": "kind-message-delta",
      "valid": true,
      "envelope": {
        "v": 1,
        "sessionId": "session-1",
        "tenantId": "tenant-1",
        "workspaceId": "workspace-1",
        "stream": "authoritative_journal",
        "sequence": 116,
        "eventId": "evt-000116",
        "kind": "message.delta",
        "occurredAt": 1760000000016,
        "payloadRef": {
          "digest": "631f42ee57f8e39d9491a76ba9477d32a11f8c2b8a3a4ff3c21b30760c600000"
        }
      }
    },
    {
      "id": "kind-message-retracted",
      "valid": true,
      "envelope": {
        "v": 1,
        "sessionId": "session-1",
        "tenantId": "tenant-1",
        "workspaceId": "workspace-1",
        "stream": "authoritative_journal",
        "sequence": 117,
        "eventId": "evt-000117",
        "kind": "message.retracted",
        "occurredAt": 1760000000016,
        "payloadRef": {
          "digest": "631f42ee57f8e39d9491a76ba9477d32a11f8c2b8a3a4ff3c21b30760c600000"
        }
      }
    },
    {
      "id": "kind-hosted-batch-planned",